{
 "sheet": {
  "file": "sprites.png",
  "colours": {
   "ink":         [ 255, 255, 255, 255 ],
   "paper":       [   0,   0,   0, 255 ],
   "transparent": [   0,   0,   0,   0 ],
   "stray":       [ 255,   0,   0, 255 ],
   "border":      [ 255,   0, 255, 255 ]
  }
 },
 "bytes": {
  "header":      ["width", "height"],
  "rows":        "bottom-up",
  "interleaved": true,
  "first":       "mask",
  "maskBit":     "covers"
 },
 "group": {
  "sabreman": {
   "group": {
    "legs": {
     "sprites": {
      "1": { "x":   1, "y": 13, "w": 24, "h": 13, "trim": 3 },
      "2": { "x":  28, "y": 13, "w": 24, "h": 13, "trim": 3 },
      "3": { "x":  55, "y": 13, "w": 24, "h": 14, "trim": 2 },
      "4": { "x":  82, "y": 13, "w": 24, "h": 15, "trim": 1 },
      "5": { "x": 109, "y": 13, "w": 24, "h": 14, "trim": 2 },
      "6": { "x": 136, "y": 13, "w": 24, "h": 13, "trim": 3 },
      "7": { "x": 163, "y": 13, "w": 24, "h": 14, "trim": 2 },
      "8": { "x": 190, "y": 13, "w": 24, "h": 16, "trim": 0 }
     }
    },
    "body": {
     "sprites": {
      "1":  { "x":   1, "y": 45, "w": 24, "h": 21, "trim": 3 },
      "2":  { "x":  28, "y": 45, "w": 24, "h": 20, "trim": 4 },
      "3":  { "x":  55, "y": 45, "w": 24, "h": 20, "trim": 4 },
      "4":  { "x":  82, "y": 45, "w": 24, "h": 21, "trim": 3 },
      "5":  { "x": 109, "y": 45, "w": 24, "h": 21, "trim": 4 },
      "6":  { "x": 136, "y": 45, "w": 24, "h": 20, "trim": 4 },
      "7":  { "x": 163, "y": 45, "w": 24, "h": 25, "trim": 0 },
      "8":  { "x": 190, "y": 45, "w": 24, "h": 25, "trim": 0 },
      "9":  { "x": 217, "y": 45, "w": 24, "h": 24, "trim": 1 },
      "10": { "x": 244, "y": 45, "w": 24, "h": 23, "trim": 2 },
      "11": { "x": 271, "y": 45, "w": 24, "h": 24, "trim": 1 },
      "12": { "x": 298, "y": 45, "w": 24, "h": 24, "trim": 1 }
     }
    }
   }
  },
  "guard": {
   "sprites": {
    "1": { "x":  1, "y": 86, "w": 24, "h": 23 },
    "2": { "x": 28, "y": 86, "w": 24, "h": 23 }
   }
  },
  "wizard": {
   "sprites": {
    "1": { "x":  1, "y": 125, "w": 24, "h": 33 },
    "2": { "x": 28, "y": 125, "w": 24, "h": 39 }
   }
  },
  "spell": {
   "sprites": {
    "1": { "x":   1, "y": 180, "w": 24, "h": 24, "trim": 0 },
    "2": { "x":  28, "y": 180, "w": 24, "h": 24, "trim": 0 },
    "3": { "x":  55, "y": 180, "w": 24, "h": 23, "trim": 1 },
    "4": { "x":  82, "y": 180, "w": 24, "h": 21, "trim": 2 },
    "5": { "x": 109, "y": 180, "w": 24, "h": 20, "trim": 1 },
    "6": { "x": 136, "y": 180, "w": 24, "h": 18, "trim": 2 }
   }
  },
  "fires": {
   "sprites": {
    "1": { "x":  1, "y": 220, "w": 16, "h": 15 },
    "2": { "x": 20, "y": 220, "w": 16, "h": 16 }
   }
  },
  "balls": {
   "sprites": {
    "1": { "x":  1, "y": 252, "w": 24, "h": 19 },
    "2": { "x": 28, "y": 252, "w": 24, "h": 18 }
   }
  },
  "ghost": {
   "sprites": {
    "1": { "x":  1, "y": 287, "w": 24, "h": 20 },
    "2": { "x": 28, "y": 287, "w": 24, "h": 19 },
    "3": { "x": 55, "y": 287, "w": 24, "h": 20 },
    "4": { "x": 82, "y": 287, "w": 24, "h": 20 }
   }
  },
  "gate": {
   "sprites": {
    "1": { "x": 1, "y": 323, "w": 24, "h": 42 }
   }
  },
  "panel": {
   "sprites": {
    "1": { "x":  1, "y": 381, "w": 16, "h":  8 },
    "2": { "x": 20, "y": 381, "w": 16, "h": 64 },
    "3": { "x": 39, "y": 381, "w": 16, "h": 16 },
    "4": { "x": 58, "y": 381, "w": 16, "h": 17 }
   }
  },
  "menu": {
   "sprites": {
    "1": { "x":  1, "y": 461, "w": 32, "h": 32, "trim": 0 },
    "2": { "x": 36, "y": 461, "w": 24, "h":  1, "trim": 0 },
    "3": { "x": 63, "y": 461, "w":  8, "h": 22, "trim": 2 }
   }
  },
  "collectable": {
   "sprites": {
    "1": { "x":   1, "y": 509, "w": 24, "h": 19 },
    "2": { "x":  28, "y": 509, "w": 24, "h": 22 },
    "3": { "x":  55, "y": 509, "w": 24, "h": 21 },
    "4": { "x":  82, "y": 509, "w": 24, "h": 23 },
    "5": { "x": 109, "y": 509, "w": 24, "h": 18 },
    "6": { "x": 136, "y": 509, "w": 24, "h": 24 },
    "7": { "x": 163, "y": 509, "w": 24, "h": 21 }
   }
  },
  "wall": {
   "group": {
    "castle": {
     "sprites": {
      "1": { "x":   1, "y": 549, "w": 40, "h": 25 },
      "2": { "x":  44, "y": 549, "w": 24, "h": 24 },
      "3": { "x":  71, "y": 549, "w": 24, "h": 18 },
      "4": { "x":  98, "y": 549, "w": 16, "h": 48 },
      "5": { "x": 117, "y": 549, "w": 16, "h": 48 },
      "6": { "x": 136, "y": 549, "w": 16, "h": 48 }
     }
    },
    "forest": {
     "sprites": {
      "1": { "x":  1, "y": 613, "w": 16, "h": 48 },
      "2": { "x": 20, "y": 613, "w": 16, "h": 48 },
      "3": { "x": 39, "y": 613, "w": 16, "h": 48 }
     }
    }
   }
  },
  "door": {
   "group": {
    "castle": {
     "sprites": {
      "1": { "x":  1, "y": 677, "w": 24, "h": 52 },
      "2": { "x": 28, "y": 677, "w": 16, "h": 35 }
     }
    },
    "forest": {
     "sprites": {
      "1": { "x":  1, "y": 745, "w": 16, "h": 60 },
      "2": { "x": 20, "y": 745, "w": 16, "h": 48 }
     }
    }
   }
  },
  "scenery": {
   "sprites": {
    "floor_spike":  { "x":   1, "y": 821, "w": 32, "h": 28 },
    "spike_ball":   { "x":  36, "y": 821, "w": 32, "h": 25 },
    "wood_block":   { "x":  71, "y": 821, "w": 32, "h": 29 },
    "gargoyle":     { "x": 106, "y": 821, "w": 24, "h": 24 },
    "block":        { "x": 133, "y": 821, "w": 32, "h": 28 },
    "chest":        { "x": 168, "y": 821, "w": 32, "h": 29 },
    "table":        { "x": 203, "y": 821, "w": 32, "h": 31 },
    "cauldron":     { "x": 238, "y": 821, "w": 32, "h": 33 },
    "cauldron_lid": { "x": 273, "y": 821, "w": 32, "h": 11 }
   }
  },
  "castle": {
   "group": {
    "torch": {
     "sprites": {
      "1": { "x":  1, "y": 870, "w": 16, "h": 25 },
      "2": { "x": 20, "y": 870, "w": 16, "h": 25 },
      "3": { "x": 39, "y": 870, "w": 16, "h": 25 },
      "4": { "x": 58, "y": 870, "w": 16, "h": 25 }
     }
    },
    "barrel": {
     "sprites": {
      "1": { "x": 77, "y": 870, "w": 24, "h": 29 }
     }
    },
    "chair": {
     "sprites": {
      "1": { "x": 104, "y": 870, "w": 24, "h": 31 }
     }
    },
    "bed": {
     "sprites": {
      "1": { "x": 131, "y": 870, "w": 40, "h": 35 }
     }
    },
    "bench": {
     "sprites": {
      "1": { "x": 174, "y": 870, "w": 32, "h": 22 }
     }
    },
    "shelf": {
     "sprites": {
      "1": { "x": 209, "y": 870, "w": 24, "h": 40 }
     }
    },
    "parapet": {
     "sprites": {
      "1": { "x": 236, "y": 870, "w": 32, "h": 31 }
     }
    },
    "bridge": {
     "sprites": {
      "deck": { "x": 271, "y": 870, "w": 32, "h": 21 },
      "rail": { "x": 306, "y": 870, "w": 24, "h": 22 }
     }
    }
   }
  }
 },
 "animations": {
  "fire":       [ "fires.1", "fires.2" ],
  "ball":       [ "balls.1", "balls.2" ],
  "guard":      [ "guard.1", "guard.2" ],
  "wizard":     [ "wizard.1", "wizard.2" ],
  "guard_walk": [
   "sabreman.legs.1",
   "sabreman.legs.2",
   "sabreman.legs.3",
   "sabreman.legs.4",
   "sabreman.legs.3",
   "sabreman.legs.2",
   "sabreman.legs.5",
   "sabreman.legs.6",
   "sabreman.legs.7",
   "sabreman.legs.8",
   "sabreman.legs.7",
   "sabreman.legs.6"
  ],
  "ghost":      [ "ghost.1", "ghost.2", "ghost.3", "ghost.4" ],
  "spell":      [ "spell.1", "spell.2", "spell.3", "spell.2" ],
  "gate":       [ "gate.1", "gate.1" ],
  "torch":      [ "castle.torch.1", "castle.torch.2", "castle.torch.3", "castle.torch.4" ]
 }
}
